{
  "$schema": "./config-schema.json",
  "project": "integrations",
  "language": "typescript",
  "repo": "langchain-ai/langchainjs",
  "packages": [
    {
      "name": "@langchain/community",
      "path": "libs/langchain-community",
      "entryPoints": ["auto"],
      "displayName": "Community",
      "versioning": {
        "tagPattern": "@langchain/community@*",
        "maxVersions": 10,
        "pathOverrides": {
          "0.x": "langchain-community"
        }
      },
      "descriptionSource": "readme"
    },
    {
      "name": "@langchain/anthropic",
      "path": "libs/providers/langchain-anthropic",
      "entryPoints": ["auto"],
      "displayName": "Anthropic",
      "versioning": {
        "tagPattern": "@langchain/anthropic@*",
        "maxVersions": 10,
        "pathOverrides": {
          "0.x": "libs/langchain-anthropic"
        }
      },
      "descriptionSource": "readme"
    },
    {
      "name": "@langchain/aws",
      "path": "libs/providers/langchain-aws",
      "entryPoints": ["auto"],
      "displayName": "AWS",
      "versioning": {
        "tagPattern": "@langchain/aws@*",
        "maxVersions": 10,
        "pathOverrides": {
          "0.x": "libs/langchain-aws"
        }
      },
      "descriptionSource": "readme"
    },
    {
      "name": "@langchain/deepseek",
      "path": "libs/providers/langchain-deepseek",
      "entryPoints": ["auto"],
      "displayName": "DeepSeek",
      "versioning": {
        "tagPattern": "@langchain/deepseek@*",
        "maxVersions": 10,
        "pathOverrides": {
          "0.x": "libs/langchain-deepseek"
        }
      },
      "descriptionSource": "readme"
    },
    {
      "name": "@langchain/google-genai",
      "path": "libs/providers/langchain-google-genai",
      "entryPoints": ["auto"],
      "displayName": "Google GenAI",
      "versioning": {
        "tagPattern": "@langchain/google-genai@*",
        "maxVersions": 10,
        "pathOverrides": {
          "0.x": "libs/langchain-google-genai"
        }
      },
      "descriptionSource": "readme"
    },
    {
      "name": "@langchain/google-vertexai",
      "path": "libs/providers/langchain-google-vertexai",
      "entryPoints": ["auto"],
      "displayName": "Google Vertex AI",
      "versioning": {
        "tagPattern": "@langchain/google-vertexai@*",
        "maxVersions": 10,
        "pathOverrides": {
          "0.x": "libs/langchain-google-vertexai"
        }
      },
      "descriptionSource": "readme"
    },
    {
      "name": "@langchain/google-vertexai-web",
      "path": "libs/providers/langchain-google-vertexai-web",
      "entryPoints": ["auto"],
      "displayName": "Google Vertex AI Web",
      "versioning": {
        "tagPattern": "@langchain/google-vertexai-web@*",
        "maxVersions": 10,
        "pathOverrides": {
          "0.x": "libs/langchain-google-vertexai-web"
        }
      },
      "descriptionSource": "readme"
    },
    {
      "name": "@langchain/groq",
      "path": "libs/providers/langchain-groq",
      "entryPoints": ["auto"],
      "displayName": "Groq",
      "versioning": {
        "tagPattern": "@langchain/groq@*",
        "maxVersions": 10,
        "pathOverrides": {
          "0.x": "libs/langchain-groq"
        }
      },
      "descriptionSource": "readme"
    },
    {
      "name": "@langchain/openai",
      "path": "libs/providers/langchain-openai",
      "entryPoints": ["auto"],
      "displayName": "OpenAI",
      "versioning": {
        "tagPattern": "@langchain/openai@*",
        "maxVersions": 10,
        "pathOverrides": {
          "0.x": "libs/langchain-openai"
        }
      },
      "descriptionSource": "readme"
    }
  ]
}
