{
  "$schema": "./config-schema.json",
  "project": "langgraph",
  "language": "typescript",
  "repo": "langchain-ai/langgraphjs",
  "packages": [
    {
      "name": "@langchain/langgraph",
      "path": "libs/langgraph-core",
      "entryPoints": ["auto"],
      "displayName": "LangGraph",
      "versioning": {
        "tagPattern": "*",
        "maxVersions": 10
      }
    },
    {
      "name": "@langchain/langgraph-sdk",
      "path": "libs/sdk",
      "entryPoints": ["auto"],
      "displayName": "LangGraph SDK",
      "versioning": {
        "tagPattern": "@langchain/langgraph-sdk@*",
        "maxVersions": 10
      }
    },
    {
      "name": "@langchain/langgraph-checkpoint",
      "path": "libs/checkpoint",
      "entryPoints": ["auto"],
      "displayName": "LangGraph Checkpoint",
      "versioning": {
        "tagPattern": "checkpoint==*",
        "maxVersions": 10
      }
    },
    {
      "name": "@langchain/langgraph-checkpoint-mongodb",
      "path": "libs/checkpoint-mongodb",
      "entryPoints": ["auto"],
      "displayName": "LangGraph Checkpoint MongoDB",
      "versioning": {
        "tagPattern": "checkpoint-mongodb==*",
        "maxVersions": 10
      }
    },
    {
      "name": "@langchain/langgraph-checkpoint-postgres",
      "path": "libs/checkpoint-postgres",
      "entryPoints": ["auto"],
      "displayName": "LangGraph Checkpoint Postgres",
      "versioning": {
        "tagPattern": "checkpoint-postgres==*",
        "maxVersions": 10
      }
    },
    {
      "name": "@langchain/langgraph-checkpoint-redis",
      "path": "libs/checkpoint-redis",
      "entryPoints": ["auto"],
      "displayName": "LangGraph Checkpoint Redis"
    },
    {
      "name": "@langchain/langgraph-checkpoint-sqlite",
      "path": "libs/checkpoint-sqlite",
      "entryPoints": ["auto"],
      "displayName": "LangGraph Checkpoint SQLite",
      "versioning": {
        "tagPattern": "checkpoint-sqlite==*",
        "maxVersions": 10
      }
    },
    {
      "name": "@langchain/langgraph-checkpoint-validation",
      "path": "libs/checkpoint-validation",
      "entryPoints": ["auto"],
      "displayName": "LangGraph Checkpoint Validation"
    },
    {
      "name": "@langchain/langgraph-api",
      "path": "libs/langgraph-api",
      "entryPoints": ["auto"],
      "displayName": "LangGraph API",
      "versioning": {
        "tagPattern": "@langchain/langgraph-api@*",
        "maxVersions": 10
      }
    },
    {
      "name": "@langchain/langgraph-cli",
      "path": "libs/langgraph-cli",
      "entryPoints": ["auto"],
      "displayName": "LangGraph CLI",
      "versioning": {
        "tagPattern": "@langchain/langgraph-cli@*",
        "maxVersions": 10
      }
    },
    {
      "name": "@langchain/langgraph-cua",
      "path": "libs/langgraph-cua",
      "entryPoints": ["auto"],
      "displayName": "LangGraph CUA",
      "versioning": {
        "tagPattern": "cua==*",
        "maxVersions": 10
      }
    },
    {
      "name": "@langchain/langgraph-supervisor",
      "path": "libs/langgraph-supervisor",
      "entryPoints": ["auto"],
      "displayName": "LangGraph Supervisor",
      "versioning": {
        "tagPattern": "supervisor==*",
        "maxVersions": 10
      }
    },
    {
      "name": "@langchain/langgraph-swarm",
      "path": "libs/langgraph-swarm",
      "entryPoints": ["auto"],
      "displayName": "LangGraph Swarm",
      "versioning": {
        "tagPattern": "swarm==*",
        "maxVersions": 10
      }
    }
  ]
}
