{
  "$schema": "./config-schema.json",
  "project": "langchain",
  "language": "typescript",
  "repo": "langchain-ai/langchainjs",
  "packages": [
    {
      "name": "langchain",
      "path": "libs/langchain",
      "entryPoints": ["auto"],
      "displayName": "LangChain",
      "index": 0,
      "versioning": {
        "tagPattern": "langchain@*",
        "maxVersions": 10,
        "pathOverrides": {
          "0.x": "langchain"
        }
      },
      "descriptionSource": "readme"
    },
    {
      "name": "@langchain/core",
      "path": "libs/langchain-core",
      "entryPoints": ["auto"],
      "displayName": "LangChain Core",
      "index": 1,
      "versioning": {
        "tagPattern": "@langchain/core@*",
        "maxVersions": 10,
        "pathOverrides": {
          "0.x": "langchain-core"
        }
      },
      "descriptionSource": "readme"
    },
    {
      "name": "@langchain/textsplitters",
      "path": "libs/langchain-textsplitters",
      "entryPoints": ["auto"],
      "displayName": "Text Splitters",
      "index": 2,
      "versioning": {
        "tagPattern": "@langchain/textsplitters@*",
        "maxVersions": 10,
        "pathOverrides": {
          "0.x": "libs/langchain-textsplitters"
        }
      },
      "descriptionSource": "readme"
    },
    {
      "name": "@langchain/mcp-adapters",
      "path": "libs/langchain-mcp-adapters",
      "entryPoints": ["auto"],
      "displayName": "MCP Adapters",
      "index": 3,
      "versioning": {
        "tagPattern": "@langchain/mcp-adapters@*",
        "maxVersions": 10,
        "pathOverrides": {
          "0.x": "libs/langchain-mcp-adapters"
        }
      },
      "descriptionSource": "readme"
    }
  ]
}
