{
  "$schema": "./config-schema.json",
  "project": "deepagent",
  "language": "typescript",
  "repo": "langchain-ai/deepagentsjs",
  "packages": [
    {
      "name": "deepagents",
      "path": "libs/deepagents",
      "entryPoints": ["auto"],
      "displayName": "Deep Agents",
      "versioning": {
        "tagPattern": "v*",
        "maxVersions": 10
      },
      "descriptionSource": "readme",
      "subpages": [
        {
          "slug": "agent",
          "title": "Agent",
          "source": "docs/deepagents/typescript/agent.md"
        },
        {
          "slug": "middleware",
          "title": "Middleware",
          "source": "docs/deepagents/typescript/middleware.md"
        },
        {
          "slug": "backends",
          "title": "Backends",
          "source": "docs/deepagents/typescript/backends.md"
        },
        {
          "slug": "skills",
          "title": "Skills",
          "source": "docs/deepagents/typescript/skills.md"
        },
        {
          "slug": "config",
          "title": "Configuration",
          "source": "docs/deepagents/typescript/config.md"
        },
        {
          "slug": "types",
          "title": "Types",
          "source": "docs/deepagents/typescript/types.md"
        }
      ]
    }
  ]
}
